{"$schema":"https://json-schema.org/draft/2020-12/schema","additionalProperties":false,"properties":{"accepted_definitions":{"items":{"type":"string"},"type":"array"},"amendment_clauses":{"items":{"type":"string"},"type":"array"},"clarifications":{"type":"array"},"clauses":{"items":{"type":"string"},"type":"array"},"contract_id":{"type":"string"},"contract_version":{"const":"2.0.0-proposed.4"},"feature_semantics_version":{"type":"string"},"gate0":{"type":"string"},"gates":{"additionalProperties":false,"properties":{"Gate0":{"type":"string"},"Gate1":{"type":"string"},"Gate2":{"type":"string"},"Gate3":{"type":"string"},"Gate4":{"type":"string"}},"required":["Gate0","Gate1","Gate2","Gate3","Gate4"],"type":"object"},"incompatible_existing_package":{"type":"string"},"inherited_acknowledgements":{"additionalProperties":false,"properties":{"historical_gate0":{"type":"string"},"new_revision_acknowledgement":{"type":"string"},"source_revision":{"type":"string"},"unchanged":{"items":{"type":"string"},"type":"array"}},"required":["historical_gate0","new_revision_acknowledgement","source_revision","unchanged"],"type":"object"},"model_package_version":{"type":"null"},"new_day_reasons":{"items":{"type":"string"},"type":"array"},"normative_files":{"items":{"type":"string"},"type":"array"},"overall_review_status":{"type":"string"},"prior_revision":{"additionalProperties":false,"properties":{"raw_contract_sha256":{"type":"string"},"source_bundle_sha256":{"type":"string"},"version":{"type":"string"}},"required":["raw_contract_sha256","source_bundle_sha256","version"],"type":"object"},"responding_to":{"additionalProperties":false,"properties":{"application_head_from_review":{"type":"string"},"application_review_date":{"type":"string"},"live_application_git_status":{"type":"string"},"review_file_sha256":{"additionalProperties":false,"properties":{"ACKNOWLEDGEMENT.md":{"type":"string"},"IMPLEMENTATION_STATUS.md":{"type":"string"},"REPRODUCTION_LOG.md":{"type":"string"},"SHOWCASE_DATA_REQUIREMENTS.md":{"type":"string"},"conflict-C01-request.json":{"type":"string"},"revision-conflicts.json":{"type":"string"}},"required":["ACKNOWLEDGEMENT.md","IMPLEMENTATION_STATUS.md","REPRODUCTION_LOG.md","SHOWCASE_DATA_REQUIREMENTS.md","conflict-C01-request.json","revision-conflicts.json"],"type":"object"},"reviewed_contract_raw_sha256":{"type":"string"},"reviewed_contract_version":{"type":"string"}},"required":["application_head_from_review","application_review_date","live_application_git_status","review_file_sha256","reviewed_contract_raw_sha256","reviewed_contract_version"],"type":"object"},"schema_version":{"type":"string"},"status":{"type":"string"}},"required":["accepted_definitions","amendment_clauses","clarifications","clauses","contract_id","contract_version","feature_semantics_version","gate0","gates","incompatible_existing_package","inherited_acknowledgements","model_package_version","new_day_reasons","normative_files","overall_review_status","prior_revision","responding_to","schema_version","status"],"type":"object"}
